{
  "property_id": "hospital_lab.no_release_before_qc",
  "template": "templates/hospital_lab/no_release_before_qc.stl",
  "input_trace_artifact": "LabTrust.Trace.v0",
  "output_certificate_artifact": "TraceCertificate.v0",
  "counterexample_artifact": "LabTrust.Counterexample.v0",
  "valid_success_status": "CertificateChecked",
  "valid_failure_status": "Rejected",
  "release_mode_required_fields": [
    "trace_hash",
    "property_id",
    "source_repo",
    "source_commit",
    "signature_or_digest"
  ],
  "repair_hints": {
    "temporal_check_failed": {
      "kind": "fix_trace_or_property",
      "command": "certifyedge check-trace --spec templates/hospital_lab/no_release_before_qc.stl --trace <trace.json>",
      "responsible_component": "runtime_producer"
    }
  }
}
